R-,Date,Docket,Name,Revised,J.,Pt.,affirmed,remanded,vacate,reversed,none detected,affirmed in part,remanded in part,vacated in part,reversed in part
5,12/10/21,21-588 (21A85),United States v. Texas, ,PC,595/1,no,no,no,no,yes,no,no,no,no
4,12/10/21,21-463,Whole Woman’s Health v. Jackson,12/10/21,NG,595/1,no,no,no,no,yes,no,no,no,no
3,11/22/21,"143, Orig.",Mississippi v. Tennessee, ,R,595/1,no,no,no,no,yes,no,no,no,no
2,10/18/21,20-1668,City of Tahlequah v. Bond,10/22/21,PC,595/1,no,no,no,no,yes,no,no,no,no
1,10/18/21,20-1539,Rivas-Villegas v. Cortesluna, ,PC,595/1,no,no,no,no,yes,no,no,no,no
68,8/26/21,21A23,Alabama Assn. of Realtors v. Department of Health and Human Servs., ,PC,594/2,no,no,no,no,yes,no,no,no,no
67,7/02/21,20-1084,Dunn v. Reeves, ,PC,594/2,no,no,no,no,yes,no,no,no,no
66,7/01/21,19-1257,Brnovich v. Democratic National Committee,7/23/21,A,594/2,no,yes,no,yes,no,no,no,no,no
65,7/01/21,19-251,Americans for Prosperity Foundation v. Bonta, ,R,594/2,no,yes,no,yes,no,no,no,no,no
64,6/29/21,20-440,"Minerva Surgical, Inc. v. Hologic, Inc.", ,EK,594/2,no,yes,yes,no,no,no,no,no,no
63,6/29/21,19-897,Johnson v. Guzman Chavez, ,A,594/2,no,yes,no,yes,no,no,no,no,no
62,6/29/21,19-1039,PennEast Pipeline Co. v. New Jersey, ,R,594/2,no,yes,yes,yes,no,no,no,no,no
61,6/28/21,20-1212,Pakdel v. City and County of San Francisco, ,PC,594/2,no,no,no,no,yes,no,no,no,no
60,6/28/21,20-391,Lombardo v. St. Louis, ,PC,594/2,no,no,yes,no,no,no,no,no,no
59,6/25/21,20-297,TransUnion LLC v. Ramirez, ,BK,594/2,no,yes,no,yes,no,no,no,no,no
58,6/25/21,20-472,"HollyFrontier Cheyenne Refining, LLC v. Renewable Fuels Assn.", ,NG,594/2,no,no,no,yes,no,no,no,no,no
57,6/25/21,20-543,Yellen v. Confederated Tribes of Chehalis Reservation,7/28/21,SS,594/2,no,yes,no,yes,no,no,no,no,no
56,6/23/21,20-18,Lange v. California,6/24/21,EK,594/1,no,no,no,no,yes,no,no,no,no
55,6/23/21,19-422,Collins v. Yellen,7/28/21,A,594/1,yes,yes,no,no,no,yes,no,yes,yes
54,6/23/21,20-255,Mahanoy Area School Dist. v. B. L., ,B,594/1,yes,no,no,no,no,no,no,no,no
53,6/23/21,20-107,Cedar Point Nursery v. Hassid, ,R,594/1,no,yes,no,yes,no,no,no,no,no
52,6/21/21,20-222,"Goldman Sachs Group, Inc. v. Arkansas Teacher Retirement System", ,AB,594/1,no,yes,yes,no,no,no,no,yes,no
51,6/21/21,20-512,National Collegiate Athletic Assn. v. Alston,6/23/21,NG,594/1,yes,no,no,no,no,no,no,no,no
50,6/21/21,19-1434,"United States v. Arthrex, Inc.",7/08/21,R,594/1,no,yes,yes,no,no,no,no,no,no
49,6/17/21,19-840,California v. Texas,7/08/21,B,593/2,no,no,no,no,yes,no,no,no,no
48,6/17/21,19-416,"Nestlé USA, Inc. v. Doe", ,T,593/2,no,no,yes,no,no,no,no,no,no
47,6/17/21,19-123,Fulton v. Philadelphia,07/08/2107/16/2108/17/21,R,593/2,no,yes,no,yes,no,no,no,no,no
46,6/14/21,19-8709,Greer v. United States, ,BK,593/2,yes,no,yes,no,no,no,no,no,no
45,6/14/21,20-5904,Terry v. United States, ,T,593/2,yes,no,no,no,no,no,no,no,no
44,6/10/21,19-5410,Borden v. United States, ,EK,593/2,no,no,yes,no,no,no,no,no,no
43,6/07/21,20-315,Sanchez v. Mayorkas, ,EK,593/2,yes,no,no,no,no,no,no,no,no
42,6/03/21,19-783,Van Buren v. United States, ,AB,593/2,no,yes,no,yes,no,no,no,no,no
41,6/01/21,19-1155,Garland v. Ming Dai,6/01/21,NG,593/2,no,no,no,no,yes,no,no,no,no
40,6/01/21,19-1414,United States v. Cooley, ,B,593/2,no,yes,yes,no,no,no,no,no,no
39,5/27/21,20-334,"San Antonio v. Hotels.com, L. P.", ,A,593/2,yes,no,no,no,no,no,no,no,no
38,5/24/21,20-437,United States v. Palomar-Santiago,6/01/21,SS,593/2,yes,no,no,no,no,no,no,no,no
37,5/24/21,20-382,Guam v. United States, ,T,593/2,no,no,no,no,yes,no,no,no,no
36,5/17/21,19-5807,Edwards v. Vannoy,5/19/21,BK,593/1,no,no,no,no,yes,no,no,no,no
35,5/17/21,19-1189,BP p.l.c. v. Mayor and City Council of Baltimore, ,NG,593/1,yes,yes,yes,no,no,no,no,no,no
34,5/17/21,19-930,"CIC Servs., LLC v. IRS", ,EK,593/1,no,yes,no,yes,no,no,no,no,no
33,5/17/21,20-157,Caniglia v. Strom, ,T,593/1,no,yes,yes,no,no,no,no,no,no
32,4/29/21,19-863,Niz-Chavez v. Garland,4/30/21,NG,593/1,no,no,no,no,yes,no,no,no,no
31,4/26/21,20-940,Alaska v. Wright, ,PC,593/1,no,no,no,no,yes,no,no,no,no
30,4/22/21,18-1259,Jones v. Mississippi, ,BK,593/1,no,no,no,no,yes,no,no,no,no
29,4/22/21,19-1442,Carr v. Saul, ,SS,593/1,no,yes,no,yes,no,no,no,no,no
28,4/22/21,19-508,"AMG Capital Management, LLC v. FTC", ,B,593/1,no,yes,no,yes,no,no,no,no,no
27,4/09/21,20A151,Tandon v. Newsom, ,PC,593/1,no,no,no,no,yes,no,no,no,no
26,4/05/21,18-956,"Google LLC v. Oracle America, Inc.",04/06/2105/03/2107/08/21,B,593/1,no,yes,no,yes,no,no,no,no,no
25,4/01/21,"142, Orig.",Florida v. Georgia, ,AB,592/2,no,no,no,no,yes,no,no,no,no
24,4/01/21,19-1231,FCC v. Prometheus Radio Project, ,BK,592/2,no,no,yes,yes,no,no,no,no,no
23,4/01/21,19-511,"Facebook, Inc. v. Duguid", ,SS,592/2,no,yes,no,yes,no,no,no,no,no
22,3/29/21,20-507,Mays v. Hines, ,PC,592/2,no,no,no,no,yes,no,no,no,no
21,3/25/21,19-368,Ford Motor Co. v. Montana Eighth Judicial Dist., ,EK,592/2,no,no,no,no,yes,no,no,no,no
20,3/25/21,19-292,Torres v. Madrid, ,R,592/2,yes,no,no,no,no,no,no,no,no
19,3/08/21,19-968,Uzuegbunam v. Preczewski, ,T,592/2,no,no,no,no,yes,no,no,no,no
18,3/04/21,19-547,"United States Fish and Wildlife Serv. v. Sierra Club, Inc.",03/09/21 07/08/21,AB,592/2,no,yes,no,yes,no,no,no,no,no
17,3/04/21,19-438,Pereida v. Wilkinson, ,NG,592/2,yes,no,no,no,no,no,no,no,no
16,2/25/21,19-546,Brownback v. King, ,T,592/2,no,no,no,yes,no,no,no,no,no
15,2/03/21,18-1447,Republic of Hungary v. Simon, ,PC,592/1,no,no,no,no,yes,no,no,no,no
14,2/03/21,19-199,Salinas v. Railroad Retirement Bd., ,SS,592/1,yes,no,no,no,no,no,no,no,no
13,2/03/21,19-351,Federal Republic of Germany v. Philipp, ,R,592/1,no,no,no,no,yes,no,no,no,no
12,1/25/21,19-963,"Henry Schein, Inc. v. Archer & White Sales, Inc.", ,PC,592/1,no,yes,yes,no,no,no,no,no,no
11,1/14/21,19-357,Chicago v. Fulton, ,A,592/1,no,yes,yes,no,no,no,no,no,no
10,12/18/20,20-366,Trump v. New York, ,PC,592/1,no,no,no,no,yes,no,no,no,no
9,12/14/20,19-1302,Shinn v. Kayer,7/08/21,PC,592/1,no,no,no,no,yes,no,no,no,no
8,12/14/20,"65, Orig.",Texas v. New Mexico, ,BK,592/1,no,no,no,no,yes,no,no,no,no
7,12/10/20,18-540,Rutledge v. Pharmaceutical Care Management Assn., ,SS,592/1,no,yes,no,yes,no,no,no,no,no
6,12/10/20,19-108,United States v. Briggs, ,A,592/1,no,no,no,no,yes,no,no,no,no
5,12/10/20,19-309,Carney v. Adams, ,B,592/1,no,no,no,no,yes,no,no,no,no
4,12/10/20,19-71,Tanzin v. Tanvir, ,T,592/1,yes,no,no,no,no,no,no,no,no
3,11/25/20,20A87,Roman Catholic Diocese of Brooklyn v. Cuomo, ,PC,592/1,no,no,no,no,yes,no,no,no,no
1,11/02/20,19-1261,Taylor v. Riojas, ,PC,592/1,no,no,no,no,yes,no,no,no,no
1,11/02/20,19-1108,Mckesson v. Doe, ,PC,592/1,no,no,no,no,yes,no,no,no,no
63,7/14/20,20A8,Barr v. Lee, ,PC,591/2,no,no,no,no,yes,no,no,no,no
62,7/09/20,17-1107,Sharp v. Murphy, ,PC,591/2,no,no,no,no,yes,no,no,no,no
61,7/09/20,18-9526,McGirt v. Oklahoma, ,NG,591/2,no,no,no,no,yes,no,no,no,no
60,7/09/20,19-715,"Trump v. Mazars USA, LLP", ,R,591/2,yes,yes,yes,no,no,no,no,no,no
59,7/09/20,19-635,Trump v. Vance, ,R,591/2,yes,yes,no,no,no,no,no,no,no
58,7/08/20,19-267,Our Lady of Guadalupe School v. Morrissey-Berru, ,A,591/2,no,no,no,yes,no,no,no,no,no
57,7/08/20,19-431,Little Sisters of the Poor Saints Peter and Paul Home v. Pennsylvania, ,T,591/2,yes,yes,yes,yes,no,no,no,no,no
56,7/06/20,19-518,Colorado Dept. of State v. Baca, ,PC,591/2,no,no,no,no,yes,no,no,no,no
55,7/06/20,19-631,"Barr v. American Assn. of Political Consultants, Inc.", ,BK,591/2,yes,no,no,no,no,no,no,no,no
54,7/06/20,19-465,Chiafalo v. Washington, ,EK,591/2,no,no,no,no,yes,no,no,no,no
53,6/30/20,19-46,Patent and Trademark Office v. Booking.com B. V., ,G,591/2,yes,no,no,no,no,no,no,yes,no
52,6/30/20,18-1195,Espinoza v. Montana Dept. of Revenue, ,R,591/2,no,yes,no,no,no,no,no,no,no
51,6/29/20,19-177,Agency for Int’l Development v. Alliance for Open Society, ,BK,591/1,yes,no,no,yes,no,no,no,no,no
50,6/29/20,18-1323,June Medical Services L. L. C. v. Russo, ,B,591/1,no,yes,no,yes,no,no,no,no,no
49,6/29/20,19-7,Seila Law LLC v. Consumer Financial Protection Bureau,7/08/20,R,591/1,no,yes,yes,no,no,no,no,no,no
48,6/25/20,19-161,Department of Homeland Security v. Thuraissigiam, ,A,591/1,no,yes,no,yes,no,no,no,no,no
47,6/22/20,18-1501,Liu v. SEC, ,SS,591/1,yes,no,no,no,no,no,no,no,no
46,6/18/20,18-587,Department of Homeland Security v. Regents of Univ. of Cal., ,R,591/1,yes,yes,no,no,no,yes,no,yes,yes
45,6/15/20,18-9674,Andrus v. Texas, ,PC,590/2,no,no,no,no,yes,no,no,no,no
44,6/15/20,17-1618,Bostock v. Clayton County, ,NG,590/2,yes,yes,yes,yes,no,no,no,no,no
43,6/15/20,18-1584,United States Forest Service v. Cowpasture River Preservation Assn., ,T,590/2,no,yes,no,yes,no,no,no,no,no
42,6/08/20,18-8369,Lomax v. Ortiz-Marquez, ,EK,590/2,no,no,no,no,yes,no,no,no,no
41,6/01/20,18-1432,Nasrallah v. Barr, ,BK,590/2,no,no,no,no,yes,no,no,no,no
40,6/01/20,17-1712,Thole v. U. S. Bank N. A., ,BK,590/2,yes,no,no,no,no,no,no,no,no
39,6/01/20,18-6943,Banister v. Davis, ,EK,590/2,no,no,no,no,yes,no,no,no,no
38,6/01/20,18-1334,"Financial Oversight and Management Bd. for Puerto Rico v. Aurelius Investment, LLC",6/05/206/08/20,B,590/2,no,yes,no,yes,no,no,no,no,no
37,6/01/20,18-1048,"GE Energy Power Conversion France SAS v. Outokumpu Stainless USA, LLC", ,T,590/2,no,yes,no,yes,no,no,no,no,no
36,5/18/20,17-1268,Opati v. Republic of Sudan, ,NG,590/1,no,yes,yes,no,no,no,no,no,no
35,5/14/20,18-1086,"Lucky Brand Dungarees, Inc. v. Marcel Fashions Group, Inc.",5/19/20,SS,590/1,no,yes,no,yes,no,no,no,no,no
34,5/07/20,18-1059,Kelly v. United States, ,EK,590/1,yes,yes,no,yes,no,no,no,no,no
33,5/07/20,19-67,United States v. Sineneng-Smith, ,G,590/1,no,yes,yes,no,no,no,no,no,no
32,4/27/20,18-280,"New York State Rifle & Pistol Assn., Inc. v. City of New York", ,PC,590/1,yes,no,no,no,no,no,no,no,no
31,4/27/20,18-1023,Maine Community Health Options v. United States, ,SS,590/1,no,no,no,no,yes,no,no,no,no
30,4/27/20,18-1150,"Georgia v. Public Resource.Org, Inc.",4/28/20,R,590/1,yes,no,no,no,no,no,no,no,no
29,4/23/20,18-725,Barton v. Barr, ,BK,590/1,yes,no,no,no,no,no,no,no,no
28,4/23/20,18-1233,"Romag Fasteners, Inc. v. Fossil Group, Inc.", ,NG,590/1,no,no,no,no,yes,no,no,no,no
27,4/23/20,18-260,County of Maui v. Hawaii Wildlife Fund, ,B,590/1,no,yes,yes,no,no,yes,no,no,no
26,4/20/20,18-5924,Ramos v. Louisiana, ,NG,590/1,no,no,no,no,yes,no,no,no,no
25,4/20/20,18-916,"Thryv, Inc. v. Click-To-Call Technologies, LP",4/28/20,G,590/1,no,yes,yes,no,no,no,no,no,no
24,4/20/20,17-1498,Atlantic Richfield Co. v. Christian, ,R,590/1,no,no,no,no,yes,no,no,no,no
23,4/06/20,19A1016,Republican National Committee v. Democratic National Committee, ,PC,589/2,no,no,no,no,yes,no,no,no,no
22,4/06/20,18-882,Babb v. Wilkie, ,A,589/2,no,no,no,no,yes,no,no,no,no
21,4/06/20,18-556,Kansas v. Glover, ,T,589/2,no,no,no,no,yes,no,no,no,no
20,3/30/20,18-565,CITGO Asphalt Refining Co. v. Frescati Shipping Co., ,SS,589/2,yes,no,no,no,no,no,no,no,no
19,3/23/20,19-5421,Davis v. United States, ,PC,589/2,no,no,no,no,yes,no,no,no,no
18,3/23/20,18-1171,Comcast Corp. v. National Assn. of African-American Owned Media, ,NG,589/2,no,no,no,no,yes,no,no,no,no
17,3/23/20,18-6135,Kahler v. Kansas, ,EK,589/2,no,no,no,no,yes,no,no,no,no
16,3/23/20,18-877,Allen v. Cooper, ,EK,589/2,yes,no,no,no,no,no,no,no,no
15,3/23/20,18-776,Guerrero-Lasprilla v. Barr, ,B,589/2,no,no,no,no,yes,no,no,no,no
14,3/03/20,17-834,Kansas v. Garcia, ,A,589/2,no,no,no,no,yes,no,no,no,no
13,2/26/20,18-1116,Intel Corp. Investment Policy Comm. v. Sulyma, ,A,589/2,yes,no,no,yes,no,no,no,no,no
12,2/26/20,18-7739,Holguin-Hernandez v. United States, ,B,589/2,yes,no,no,no,no,no,no,no,no
11,2/26/20,18-6662,Shular v. United States, ,G,589/2,yes,no,no,no,no,no,no,no,no
10,2/25/20,18-1109,McKinney v. Arizona, ,BK,589/1,no,yes,yes,no,no,no,no,no,no
9,2/25/20,18-1269,Rodriguez v. FDIC, ,NG,589/1,no,yes,yes,no,no,no,no,no,no
8,2/25/20,17-1678,Hernández v. Mesa, ,A,589/1,yes,yes,yes,no,no,no,no,no,no
7,2/25/20,18-935,Monasky v. Taglieri,2/26/20,G,589/1,yes,yes,no,no,no,no,no,no,no
6,2/24/20,18-921,Roman Catholic Archdiocese of San Juan v. Acevedo Feliciano, ,PC,589/1,no,no,no,no,yes,no,no,no,no
5,1/14/20,18-1165,Retirement Plans Comm. of IBM v. Jander, ,PC,589/1,no,no,no,no,yes,no,no,no,no
4,1/14/20,18-938,"Ritzen Group, Inc. v. Jackson Masonry, LLC", ,G,589/1,yes,no,no,no,no,no,no,no,no
3,12/11/19,18-801,"Peter v. NantKwest, Inc.", ,SS,589/1,yes,no,no,no,no,no,no,no,no
2,12/10/19,18-328,Rotkiske v. Klemm, ,T,589/1,yes,no,no,no,no,no,no,no,no
1,11/25/19,19-122,Thompson v. Hebdon, ,PC,589/1,no,no,no,no,yes,no,no,no,no
73,6/27/19,18-6210,Mitchell v. Wisconsin, ,A,588/2,no,no,no,no,yes,no,no,no,no
72,6/27/19,18-966,Department of Commerce v. New York, ,R,588/2,no,no,no,no,yes,no,no,no,no
71,6/27/19,18-422,Rucho v. Common Cause, ,R,588/2,no,no,no,no,yes,no,no,no,no
70,6/26/19,17-1672,United States v. Haymond, ,NG,588/2,no,yes,yes,no,no,no,no,no,no
69,6/26/19,18-15,Kisor v. Wilkie, ,EK,588/2,no,yes,yes,no,no,no,no,no,no
68,6/26/19,18-96,Tennessee Wine and Spirits Retailers Assn. v. Thomas, ,A,588/2,yes,no,no,no,no,no,no,no,no
67,6/24/19,18-431,United States v. Davis, ,NG,588/2,no,yes,yes,no,no,yes,no,yes,no
66,6/24/19,18-481,Food Marketing Institute v. Argus Leader Media, ,NG,588/2,no,yes,no,yes,no,no,no,no,no
65,6/24/19,18-302,Iancu v. Brunetti, ,EK,588/2,yes,no,no,no,no,no,no,no,no
64,6/24/19,18-266,Dutra Group v. Batterton, ,A,588/2,no,yes,no,yes,no,no,no,no,no
63,6/21/19,17-9572,Flowers v. Mississippi, ,BK,588/1,no,no,no,no,yes,no,no,no,no
62,6/21/19,18-457,North Carolina Dept. of Revenue v. Kimberley Rice Kaestner 1992 Family Trust, ,SS,588/1,no,no,no,no,yes,no,no,no,no
61,6/21/19,17-9560,Rehaif v. United States,6/24/19,B,588/1,yes,yes,no,yes,no,no,no,no,no
60,6/21/19,17-647,Knick v. Township of Scott, ,R,588/1,no,yes,yes,no,no,no,no,no,no
59,6/20/19,17-6086,Gundy v. United States, ,EK,588/1,no,no,no,no,yes,no,no,no,no
58,6/20/19,18-485,McDonough v. Smith, ,SS,588/1,no,yes,no,yes,no,no,no,no,no
57,6/20/19,17-1717,American Legion v. American Humanist Assn., ,A,588/1,no,yes,no,yes,no,no,no,no,no
56,6/20/19,17-1705,"PDR Network, LLC v. Carlton Harris Chiropractic, Inc.", ,B,588/1,no,yes,yes,no,no,no,no,yes,no
55,6/17/19,17-1702,Manhattan Community Access Corp. v. Halleck, ,BK,587/2,no,yes,no,no,no,no,no,no,yes
54,6/17/19,16-1275,"Virginia Uranium, Inc. v. Warren", ,NG,587/2,yes,no,no,no,no,no,no,no,no
53,6/17/19,17-646,Gamble v. United States,7/19/19,A,587/2,no,no,no,no,yes,no,no,no,no
52,6/17/19,18-281,Virginia House of Delegates v. Bethune-Hill, ,G,587/2,no,no,no,no,yes,no,no,no,no
51,6/10/19,17-778,Quarles v. United States, ,BK,587/2,yes,no,no,no,no,no,no,no,no
50,6/10/19,17-1594,"Return Mail, Inc. v. Postal Service", ,SS,587/2,no,yes,no,yes,no,no,no,no,no
49,6/10/19,18-389,"Parker Drilling Management Services, Ltd. v. Newton", ,T,587/2,no,yes,yes,no,no,no,no,no,no
48,6/03/19,17-1484,Azar v. Allina Health Services, ,NG,587/2,yes,no,yes,yes,no,no,no,no,no
47,6/03/19,18-489,Taggart v. Lorenzen, ,B,587/2,yes,yes,yes,no,no,no,no,no,no
46,6/03/19,18-525,Fort Bend County v. Davis, ,G,587/2,yes,no,no,yes,no,no,no,no,no
45,6/03/19,17-8995,Mont v. United States,6/03/19,T,587/2,no,no,no,no,yes,no,no,no,no
44,5/28/19,18-483,"Box v. Planned Parenthood of Indiana and Kentucky, Inc.", ,PC,587/2,yes,no,no,no,no,no,no,no,no
43,5/28/19,17-1606,Smith v. Berryhill, ,SS,587/2,no,yes,no,yes,no,no,no,no,no
42,5/28/19,17-1471,"Home Depot U. S. A., Inc. v. Jackson", ,T,587/2,yes,no,no,no,no,no,no,no,no
41,5/28/19,17-1174,Nieves v. Bartlett, ,R,587/2,no,no,no,no,yes,no,no,no,no
40,5/20/19,17-1657,"Mission Product Holdings, Inc. v. Tempnology, LLC", ,EK,587/1,no,yes,no,yes,no,no,no,no,no
39,5/20/19,17-532,Herrera v. Wyoming, ,SS,587/1,no,no,no,yes,no,no,no,no,no
38,5/20/19,17-290,Merck Sharp & Dohme Corp. v. Albrecht, ,B,587/1,no,yes,yes,no,no,no,no,no,no
37,5/13/19,17-204,Apple Inc. v. Pepper, ,BK,587/1,yes,no,no,no,no,no,no,no,no
36,5/13/19,18-315,"Cochise Consultancy, Inc. v. United States ex rel. Hunt", ,T,587/1,yes,no,no,no,no,no,no,no,no
35,5/13/19,17-1299,Franchise Tax Bd. of Cal. v. Hyatt, ,T,587/1,no,no,no,no,yes,no,no,no,no
34,4/29/19,17-1201,Thacker v. TVA, ,EK,587/1,no,yes,no,yes,no,no,no,no,no
33,4/24/19,17-988,"Lamps Plus, Inc. v. Varela", ,R,587/1,no,no,no,no,yes,no,no,no,no
32,4/23/19,18-459,Emulex Corp. v. Varjabedian, ,PC,587/1,no,no,no,no,yes,no,no,no,no
31,4/01/19,17-8151,Bucklew v. Precythe,4/01/19,NG,587/1,yes,no,no,no,no,no,no,no,no
30,4/01/19,17-1184,Biestek v. Berryhill, ,EK,587/1,yes,no,no,no,no,no,no,no,no
29,3/27/19,17-1077,Lorenzo v. SEC, ,B,587/1,yes,no,no,no,no,no,no,no,no
28,3/26/19,17-949,Sturgeon v. Frost, ,EK,587/1,no,yes,yes,no,no,no,no,no,no
27,3/26/19,16-1094,Republic of Sudan v. Harrison, ,A,587/1,no,yes,no,yes,no,no,no,no,no
26,3/20/19,17-961,Frank v. Gaos, ,PC,586/2,no,no,no,no,yes,no,no,no,no
25,3/20/19,17-1307,Obduskey v. McCarthy & Holthus LLP, ,B,586/2,yes,no,no,no,no,no,no,no,no
24,3/19/19,17-1104,Air & Liquid Systems Corp. v. DeVries, ,BK,586/2,yes,yes,yes,no,no,no,no,no,no
23,3/19/19,16-1363,Nielsen v. Preap, ,A,586/2,no,no,no,no,yes,no,no,no,no
22,3/19/19,16-1498,"Washington State Dept. of Licensing v. Cougar Den, Inc.",3/29/19,B,586/2,no,no,no,no,yes,no,no,no,no
21,3/04/19,17-1625,"Rimini Street, Inc. v. Oracle USA, Inc.", ,BK,586/2,no,yes,no,no,no,no,no,no,yes
20,3/04/19,17-1042,BNSF R. Co. v. Loos,3/04/19,G,586/2,no,yes,no,yes,no,no,no,no,no
19,3/04/19,17-571,Fourth Estate Pub. Benefit Corp. v. Wall-Street.com, ,G,586/2,yes,no,no,no,no,no,no,no,no
18,2/27/19,17-7505,Madison v. Alabama,2/27/19,EK,586/2,no,no,no,no,yes,no,no,no,no
17,2/27/19,17-1026,Garza v. Idaho, ,SS,586/2,no,no,yes,no,no,no,no,no,no
16,2/27/19,17-1011,Jam v. International Finance Corp.,7/16/19,R,586/2,no,yes,no,yes,no,no,no,no,no
15,2/26/19,17-1094,Nutraceutical Corp. v. Lambert, ,SS,586/2,no,yes,no,yes,no,no,no,no,no
14,2/25/19,18-272,Yovino v. Rizo, ,PC,586/2,no,no,no,no,yes,no,no,no,no
13,2/20/19,17-419,Dawson v. Steager, ,NG,586/2,no,no,no,no,yes,no,no,no,no
12,2/20/19,17-1091,Timbs v. Indiana, ,G,586/2,no,no,no,no,yes,no,no,no,no
11,2/19/19,18-443,Moore v. Texas, ,PC,586/2,no,no,no,no,yes,no,no,no,no
10,1/22/19,17-1229,"Helsinn Healthcare S. A. v. Teva Pharmaceuticals USA, Inc.", ,T,586/1,yes,no,no,no,no,no,no,no,no
9,1/15/19,17-340,New Prime Inc. v. Oliveira, ,NG,586/1,yes,no,no,no,no,no,no,no,no
8,1/15/19,17-5554,Stokeling v. United States, ,T,586/1,no,no,no,no,yes,no,no,no,no
7,1/08/19,17-1272,"Henry Schein, Inc. v. Archer & White Sales, Inc.", ,BK,586/1,no,yes,yes,no,no,no,no,no,no
6,1/08/19,17-773,Culbertson v. Berryhill, ,T,586/1,no,yes,no,yes,no,no,no,no,no
5,1/07/19,18-56,Shoop v. Hill, ,PC,586/1,no,no,no,no,yes,no,no,no,no
4,1/07/19,17-1660,Escondido v. Emmons, ,PC,586/1,no,no,no,no,yes,no,no,no,no
3,12/10/18,17-765,United States v. Stitt, ,B,586/1,no,no,no,no,yes,no,no,no,no
2,11/27/18,17-71,Weyerhaeuser Co. v. United States Fish and Wildlife Serv., ,R,586/1,no,yes,yes,no,no,no,no,no,no
1,11/06/18,17-587,Mount Lemmon Fire Dist. v. Guido, ,G,586/1,yes,no,no,no,no,no,no,no,no
76,6/28/18,17-1364,North Carolina v. Covington, ,PC,585/2,no,no,no,no,yes,no,no,no,no
75,6/28/18,17-1106,Sexton v. Beaudreaux, ,PC,585/2,no,no,no,no,yes,no,no,no,no
74,6/28/18,17-742,Sause v. Bauer, ,PC,585/2,no,no,no,no,yes,no,no,no,no
73,6/27/18,16-1466,"Janus v. State, County, and Municipal Employees", ,A,585/2,no,yes,no,yes,no,no,no,no,no
72,6/27/18,"142, Orig.",Florida v. Georgia,11/02/18,B,585/2,no,no,no,no,yes,no,no,no,no
71,6/26/18,16-1140,National Institute of Family and Life Advocates v. Becerra, ,T,585/2,yes,yes,no,yes,no,no,no,no,no
70,6/26/18,17-965,Trump v. Hawaii, ,R,585/2,no,no,no,no,yes,no,no,no,no
69,6/25/18,17-586,Abbott v. Perez, ,A,585/2,no,no,no,no,yes,no,no,no,no
68,6/25/18,16-1454,Ohio v. American Express Co.,6/25/18,T,585/2,yes,no,no,yes,no,no,no,no,no
67,6/22/18,16-1017,Cox v. United States, ,PC,585/1,no,no,no,no,yes,no,no,no,no
66,6/22/18,16-961,Dalmazzi v. United States, ,PC,585/1,no,no,no,no,yes,no,no,no,no
65,6/22/18,16-1348,Currier v. Virginia, ,NG,585/1,no,no,no,no,yes,no,no,no,no
64,6/22/18,16-1423,Ortiz v. United States,6/25/18,EK,585/1,yes,no,no,no,no,no,no,no,no
63,6/22/18,16-1011,WesternGeco LLC v. ION Geophysical Corp., ,T,585/1,no,yes,yes,yes,no,no,no,no,no
62,6/22/18,16-402,Carpenter v. United States,6/29/18,R,585/1,no,yes,yes,yes,no,no,no,no,no
61,6/21/18,17-530,Wisconsin Central Ltd. v. United States, ,NG,585/1,no,yes,no,yes,no,no,no,no,no
60,6/21/18,17-130,Lucia v. SEC, ,EK,585/1,no,no,no,no,yes,no,no,no,no
59,6/21/18,17-459,Pereira v. Sessions, ,SS,585/1,no,yes,no,yes,no,no,no,no,no
58,6/21/18,17-494,"South Dakota v. Wayfair, Inc.", ,K,585/1,no,no,no,no,yes,no,no,no,no
57,6/18/18,17-333,Benisek v. Lamone, ,PC,585/1,no,no,no,no,yes,no,no,no,no
56,6/18/18,16-9493,Rosales-Mireles v. United States, ,SS,585/1,no,yes,yes,yes,no,no,no,no,no
55,6/18/18,17-5639,Chavez-Meza v. United States, ,B,585/1,yes,no,no,no,no,no,no,no,no
54,6/18/18,17-21,Lozman v. Riviera Beach, ,K,585/1,no,no,no,yes,no,no,no,no,no
53,6/18/18,16-1161,Gill v. Whitford, ,R,585/1,no,no,no,no,yes,no,no,no,no
52,6/14/18,16-1220,"Animal Science Products, Inc. v. Hebei Welcome Pharmaceutical Co.", ,G,585/1,no,yes,yes,no,no,no,no,yes,no
51,6/14/18,16-1435,Minnesota Voters Alliance v. Mansky, ,R,585/1,no,yes,no,yes,no,no,no,no,no
50,6/11/18,17-269,Washington v. United States, ,PC,584/2,no,no,no,no,yes,no,no,no,no
49,6/11/18,16-1432,Sveen v. Melin, ,EK,584/2,no,yes,no,yes,no,no,no,no,no
48,6/11/18,16-980,Husted v. A. Philip Randolph Institute, ,A,584/2,no,no,no,yes,no,no,no,no,no
47,6/11/18,17-432,"China Agritech, Inc. v. Resh", ,G,584/2,no,yes,no,yes,no,no,no,no,no
46,6/04/18,17-654,Azar v. Garza, ,PC,584/2,no,no,no,no,yes,no,no,no,no
45,6/04/18,16-1215,"Lamar, Archer & Cofrin, LLP v. Appling", ,SS,584/2,yes,no,no,no,no,no,no,no,no
44,6/04/18,17-5716,Koons v. United States, ,A,584/2,no,no,no,no,yes,no,no,no,no
43,6/04/18,17-155,Hughes v. United States,6/05/18,K,584/2,no,yes,no,yes,no,no,no,no,no
42,6/04/18,16-111,"Masterpiece Cakeshop, Ltd. v. Colorado Civil Rights Comm’n",6/04/186/13/18,K,584/2,no,no,no,no,yes,no,no,no,no
41,5/29/18,16-1495,City of Hays v. Vogt, ,PC,584/2,no,no,no,no,yes,no,no,no,no
40,5/29/18,16-1027,Collins v. Virginia, ,SS,584/2,no,no,no,no,yes,no,no,no,no
39,5/29/18,16-1519,Lagos v. United States, ,B,584/2,no,yes,no,yes,no,no,no,no,no
38,5/21/18,17-387,Upper Skagit Tribe v. Lundgren, ,NG,584/2,no,no,no,no,yes,no,no,no,no
37,5/21/18,16-285,Epic Systems Corp. v. Lewis, ,NG,584/2,yes,yes,no,no,no,no,no,no,no
36,5/14/18,16-476,Murphy v. National Collegiate Athletic Assn., ,A,584/2,no,no,no,yes,no,no,no,no,no
35,5/14/18,17-43,Dahda v. United States, ,B,584/2,no,no,no,no,yes,no,no,no,no
34,5/14/18,16-8255,McCoy v. Louisiana, ,G,584/2,no,no,no,no,yes,no,no,no,no
33,5/14/18,16-1371,Byrd v. United States, ,K,584/2,yes,no,no,no,no,no,no,no,no
32,5/14/18,17-312,United States v. Sanchez-Gomez, ,R,584/2,no,yes,yes,no,no,no,no,no,no
31,4/24/18,16-969,SAS Institute Inc. v. Iancu, ,NG,584/1,no,yes,no,yes,no,no,no,no,no
30,4/24/18,16-712,"Oil States Energy Services, LLC v. Greene’s Energy Group, LLC", ,T,584/1,no,no,no,no,yes,no,no,no,no
29,4/24/18,16-499,"Jesner v. Arab Bank, PLC",4/30/18,K,584/1,no,no,no,no,yes,no,no,no,no
28,4/17/18,17-2,United States v. Microsoft Corp., ,PC,584/1,no,no,no,no,yes,no,no,no,no
27,4/17/18,15-1498,Sessions v. Dimaya, ,EK,584/1,yes,no,no,no,no,no,no,no,no
26,4/17/18,16-6855,Wilson v. Sellers, ,B,584/1,yes,yes,no,yes,no,no,no,no,no
25,4/02/18,17-467,Kisela v. Hughes, ,PC,584/1,no,no,no,no,yes,no,no,no,no
24,4/02/18,16-1362,"Encino Motorcars, LLC v. Navarro", ,T,584/1,no,yes,yes,no,no,no,no,no,no
23,3/27/18,16-1150,Hall v. Hall, ,R,584/1,yes,no,no,no,no,no,no,no,no
22,3/21/18,16-6795,Ayestas v. Davis, ,A,584/1,no,yes,yes,no,no,no,no,no,no
21,3/21/18,16-1144,Marinello v. United States, ,B,584/1,no,yes,no,yes,no,no,no,no,no
20,3/20/18,15-1439,"Cyan, Inc. v. Beaver County Employees Retirement Fund", ,EK,583/2,no,no,no,no,yes,no,no,no,no
19,3/05/18,"141, Orig.",Texas v. New Mexico, ,NG,583/2,no,no,no,no,yes,no,no,no,no
18,3/05/18,15-1509,"U. S. Bank N. A. v. Village at Lakeridge, LLC", ,EK,583/2,yes,no,no,no,no,no,no,no,no
17,2/27/18,16-784,"Merit Management Group, LP v. FTI Consulting, Inc.", ,SS,583/2,no,no,no,no,yes,no,no,no,no
16,2/27/18,15-1204,Jennings v. Rodriguez, ,A,583/2,no,yes,no,yes,no,no,no,no,no
15,2/27/18,16-498,Patchak v Zinke,11/06/18,T,583/2,no,no,no,no,yes,no,no,no,no
14,2/21/18,16-1067,Murphy v. Smith, ,NG,583/2,yes,no,no,no,no,no,no,no,no
13,2/21/18,16-534,Rubin v. Islamic Republic of Iran, ,SS,583/2,yes,no,no,no,no,no,no,no,no
12,2/21/18,16-424,Class v. United States, ,B,583/2,no,no,no,no,yes,no,no,no,no
11,2/21/18,16-1276,"Digital Realty Trust, Inc. v. Somers", ,G,583/2,no,yes,no,yes,no,no,no,no,no
10,2/20/18,"137, Orig",Montana v Wyoming,2/20/18,D,583/2,no,no,no,no,yes,no,no,no,no
9,2/20/18,17-515,CNH Industrial N. V. v. Reese, ,PC,583/2,no,no,no,no,yes,no,no,no,no
8,1/22/18,16-299,National Assn. of Mfrs. v. Department of Defense, ,SS,583/1,no,yes,no,yes,no,no,no,no,no
7,1/22/18,16-460,Artis v. District of Columbia, ,G,583/1,no,no,no,no,yes,no,no,no,no
6,1/22/18,15-1485,District of Columbia v. Wesby,1/22/18,T,583/1,no,yes,no,yes,no,no,no,no,no
5,1/08/18,17-6075,Tharpe v. Sellers, ,PC,583/1,no,no,no,no,yes,no,no,no,no
3,11/08/17,16-658,Hamer v. Neighborhood Housing Servs. of Chicago, ,G,583/1,no,yes,yes,no,no,no,no,no,no
2,11/06/17,17-193,Dunn v. Madison, ,PC,583/1,no,no,no,no,yes,no,no,no,no
1,11/06/17,16-1468,Kernan v. Cuero, ,PC,583/1,no,no,no,no,yes,no,no,no,no
70,6/26/17,16-1436,Trump. v. International Refugee Assistance Project, ,PC,582/2,no,no,no,no,yes,no,no,no,no
